<?xml version="1.0" encoding="UTF-8"?>
<GQOKMW_BEADANDO xmlns:xs="http://www.w3.org/2001/XMLSchema-instance"
    xs:noNamespaceSchemaLocation="XMLSchemaGQOKMW.xsd">

    <!-- Vásárlók -->
    <Vasarlo V_id="1" M_id="01">
        <Nev>Kiss Ádám</Nev>
        <Cim>
            <Utca>Kossuth Lajos utca</Utca>
            <Varos>Miskolc</Varos>
            <Hazszam>1</Hazszam>
        </Cim>
        <Telefonszam>0630-1234567</Telefonszam>
    </Vasarlo>

    <Vasarlo V_id="2" M_id="02">
        <Nev>Nagy Pista</Nev>
        <Cim>
            <Utca>Árpád utca</Utca>
            <Varos>Szekszárd</Varos>
            <Hazszam>5</Hazszam>
        </Cim>
        <Telefonszam>0630-3214569</Telefonszam>
    </Vasarlo>

    <Vasarlo V_id="3" M_id="03">
        <Nev>Nagy Máté</Nev>
        <Cim>
            <Utca>József Attila út</Utca>
            <Varos>Esztergom</Varos>
            <Hazszam>5</Hazszam>
        </Cim>
        <Telefonszam>0630-1234765</Telefonszam>
        <Telefonszam>0630-7654321</Telefonszam>
    </Vasarlo>

    <!-- Megrendelés -->

    <Megrendeles M_id="01">
        <Hatarido>2021-02-03</Hatarido>
        <Megrendelesideje>2021-02-01</Megrendelesideje>
        <Statusz>Teljesítve</Statusz>
    </Megrendeles>

    <Megrendeles M_id="02">
        <Hatarido>2021-02-07</Hatarido>
        <Megrendelesideje>2021-02-02</Megrendelesideje>
        <Statusz>Szállítás alatt</Statusz>
    </Megrendeles>

    <Megrendeles M_id="03">
        <Hatarido>2021-03-05</Hatarido>
        <Megrendelesideje>2021-03-01</Megrendelesideje>
        <Statusz>Teljesítve</Statusz>
    </Megrendeles>

    <!-- Megrendelt termék-->

    <Megrendelttermek M_id="01" MT_id="11">
        <Learazas>0.2</Learazas>
        <Mennyiseg>2</Mennyiseg>
        <Listaar>25000</Listaar>
    </Megrendelttermek>

    <Megrendelttermek M_id="02" MT_id="12">
        <Learazas>0.2</Learazas>
        <Mennyiseg>2</Mennyiseg>
        <Listaar>25000</Listaar>
    </Megrendelttermek>

    <Megrendelttermek M_id="03" MT_id="13">
        <Learazas>0.2</Learazas>
        <Mennyiseg>2</Mennyiseg>
        <Listaar>25000</Listaar>
    </Megrendelttermek>

    <!-- Üzlet -->

    <Üzlet Ü_id="21" MT_id="11">
        <Cim>
            <Utca>Lajos utca</Utca>
            <Varos>Miskolc</Varos>
            <Hazszam>6</Hazszam>
        </Cim>
        <Nev>Hervis</Nev>
        <Telefonszam>0670-5312490</Telefonszam>
        <Telefonszam>0630-6587421</Telefonszam>
    </Üzlet>

    <Üzlet Ü_id="22" MT_id="12">
        <Cim>
            <Utca>Lajos utca</Utca>
            <Varos>Miskolc</Varos>
            <Hazszam>6</Hazszam>
        </Cim>
        <Nev>Intersport</Nev>
        <Telefonszam>0670-5312490</Telefonszam>
        <Telefonszam>0630-6587421</Telefonszam>
    </Üzlet>

    <Üzlet Ü_id="23" MT_id="13">
        <Cim>
            <Utca>Lajos utca</Utca>
            <Varos>Miskolc</Varos>
            <Hazszam>6</Hazszam>
        </Cim>
        <Nev>Dechatlon</Nev>
        <Telefonszam>0670-5312490</Telefonszam>
        <Telefonszam>0630-6587421</Telefonszam>
    </Üzlet>

    <!-- Ü_D -->
    <Ü_D Ü_id="21" D_id="31">
        <Fizetes>420000</Fizetes>
    </Ü_D>
    <Ü_D Ü_id="22" D_id="32">
        <Fizetes>530000</Fizetes>
    </Ü_D>
    <Ü_D Ü_id="23" D_id="33">
        <Fizetes>370000</Fizetes>
    </Ü_D>

    <!-- Dolgozók -->

    <Dolgozo D_id="31">
        <Cim>
            <Utca>Oláh Lajos</Utca>
            <Varos>Miskolc</Varos>
            <Hazszam>6</Hazszam>
        </Cim>
        <Nev>Nagy Gergő</Nev>
        <Telefonszam>0670-5342490</Telefonszam>
        <Telefonszam>0630-6596521</Telefonszam>
    </Dolgozo>

    <Dolgozo D_id="32">
        <Cim>
            <Utca>Deaák ferenc</Utca>
            <Varos>Arnót</Varos>
            <Hazszam>8</Hazszam>
        </Cim>
        <Nev>Kiss Árpád</Nev>
        <Telefonszam>0670-5643905</Telefonszam>
        <Telefonszam>0630-6734524</Telefonszam>
    </Dolgozo>

    <Dolgozo D_id="33">
        <Cim>
            <Utca>Kossuth Lajos</Utca>
            <Varos>Miskolc</Varos>
            <Hazszam>56</Hazszam>
        </Cim>
        <Nev>Szabó Gergő</Nev>
        <Telefonszam>0670-5723490</Telefonszam>
        <Telefonszam>0630-9654321</Telefonszam>
    </Dolgozo>

</GQOKMW_BEADANDO>